{
  "goal_number": 1,
  "summary": "Новая иконка турнира в пакете, затем использование в админке. UI-пакет не трогаем.",
  "status": "ready",
  "surfaces": ["icons", "admin"],
  "human_gates": [
    "выбор варианта иконки в PR win-predict-ai-icons",
    "приёмка → Ready to Release (merge делает вотчер)"
  ],
  "tasks": [
    {
      "id": "icons-tournament",
      "surface": "icons",
      "repo": "onlyzoran/win-predict-ai-icons",
      "title": "Иконка турнира (3–4 варианта)",
      "body": "Parent: onlyzoran/win-predict-ai-orchestrator#1\n\nНужна outline-иконка турнира в стиле Tabler для админки.\n\nКритерий куска: выбран один вариант, PR готов к merge.\n",
      "depends_on": [],
      "parallel_group": 1,
      "trigger": { "type": "slash", "command": "/new-icon" },
      "done_when": "В PR выбран вариант, CI зелёный."
    },
    {
      "id": "admin-use-icon",
      "surface": "admin",
      "repo": "onlyzoran/win-predict-ai-admin",
      "title": "Подключить иконку турнира после публикации пакета",
      "body": "Parent: onlyzoran/win-predict-ai-orchestrator#1\n\nПосле публикации @onlyzoran/win-predict-ai-icons использовать новую иконку в UI турниров.\nBump пакета делает существующий агент — этот issue только про интеграцию в admin.\n\nКритерий куска: иконка видна в админке, PR готов к merge.\n",
      "depends_on": ["icons-tournament"],
      "parallel_group": 2,
      "trigger": { "type": "issue_only" },
      "done_when": "PR в win-predict-ai-admin зелёный и показывает иконку."
    }
  ]
}
